{
  "schema_version": "1.0",
  "scenario_id": "SCN_0071",
  "container": {
    "container_id": "P1210-H085",
    "length_mm": 1200,
    "width_mm": 1000,
    "max_height_mm": 850,
    "max_payload_kg": 1000.0,
    "coordinate_frame": "container_bottom_center"
  },
  "items": [
    {
      "item_id": "item_01",
      "geometry_id": "G_590x395x295",
      "dimensions_mm": {
        "length": 590,
        "width": 395,
        "height": 295
      },
      "mass_kg": 9.54,
      "weight_class": "heavy",
      "material": "Plastic",
      "fragile": false,
      "stackable": true,
      "top_load_limit_kg_synthetic": 75.62,
      "product_category": "general"
    },
    {
      "item_id": "item_02",
      "geometry_id": "G_595x400x300",
      "dimensions_mm": {
        "length": 595,
        "width": 400,
        "height": 300
      },
      "mass_kg": 9.4,
      "weight_class": "heavy",
      "material": "Plastic",
      "fragile": false,
      "stackable": true,
      "top_load_limit_kg_synthetic": 235.62,
      "product_category": "general"
    },
    {
      "item_id": "item_03",
      "geometry_id": "G_385x385x165",
      "dimensions_mm": {
        "length": 385,
        "width": 385,
        "height": 165
      },
      "mass_kg": 6.53,
      "weight_class": "medium",
      "material": "Plastic",
      "fragile": false,
      "stackable": true,
      "top_load_limit_kg_synthetic": 80.71,
      "product_category": "general"
    },
    {
      "item_id": "item_04",
      "geometry_id": "G_590x390x290",
      "dimensions_mm": {
        "length": 590,
        "width": 390,
        "height": 290
      },
      "mass_kg": 9.01,
      "weight_class": "heavy",
      "material": "Cardboard",
      "fragile": false,
      "stackable": true,
      "top_load_limit_kg_synthetic": 66.73,
      "product_category": "general"
    },
    {
      "item_id": "item_05",
      "geometry_id": "G_590x390x290",
      "dimensions_mm": {
        "length": 590,
        "width": 390,
        "height": 290
      },
      "mass_kg": 9.01,
      "weight_class": "heavy",
      "material": "Cardboard",
      "fragile": false,
      "stackable": true,
      "top_load_limit_kg_synthetic": 66.73,
      "product_category": "general"
    },
    {
      "item_id": "item_06",
      "geometry_id": "G_390x380x170",
      "dimensions_mm": {
        "length": 390,
        "width": 380,
        "height": 170
      },
      "mass_kg": 6.53,
      "weight_class": "medium",
      "material": "Cardboard",
      "fragile": false,
      "stackable": true,
      "top_load_limit_kg_synthetic": 28.34,
      "product_category": "electronics"
    },
    {
      "item_id": "item_07",
      "geometry_id": "G_595x400x255",
      "dimensions_mm": {
        "length": 595,
        "width": 400,
        "height": 255
      },
      "mass_kg": 6.9,
      "weight_class": "medium",
      "material": "Cardboard",
      "fragile": true,
      "stackable": true,
      "top_load_limit_kg_synthetic": 45.52,
      "product_category": "general"
    },
    {
      "item_id": "item_08",
      "geometry_id": "G_400x400x190",
      "dimensions_mm": {
        "length": 400,
        "width": 400,
        "height": 190
      },
      "mass_kg": 7.632,
      "weight_class": "medium",
      "material": "Cardboard",
      "fragile": false,
      "stackable": false,
      "top_load_limit_kg_synthetic": 22.8,
      "product_category": "general"
    }
  ],
  "arrival_order": [
    "item_01",
    "item_02",
    "item_03",
    "item_04",
    "item_05",
    "item_06",
    "item_07",
    "item_08"
  ],
  "buffer_size": 1,
  "instruction": {
    "instruction_id": "INS_08c48c7bcb71",
    "text": "电子产品箱不得与重物箱直接接触或形成上下支撑关系。"
  }
}
